{
  "areaKey" : "floor-1",
  "captureId" : "22bfb513-226d-4eca-bde1-0b6cb0c84aad",
  "coordinateSystem" : {
    "handedness" : "right",
    "units" : "m",
    "up" : "+Y"
  },
  "doors" : [
    {
      "bottomM" : 0,
      "confidence" : "high",
      "heightM" : 2.1,
      "id" : "door-1",
      "isOpen" : false,
      "offsetM" : 3,
      "wallId" : "wall-4",
      "widthM" : 0.9
    }
  ],
  "label" : "Floor 1",
  "objects" : [
    {
      "box" : {
        "center" : [
          2,
          0.375,
          1.5
        ],
        "rotation" : [
          0,
          0,
          0,
          1
        ],
        "sizeM" : [
          1.2,
          0.75,
          0.8
        ]
      },
      "category" : "table",
      "confidence" : "high",
      "id" : "object-1",
      "roomId" : "room-1"
    }
  ],
  "openings" : [

  ],
  "refs" : [
    {
      "path" : "Original Exports/floor-1/22bfb513-226d-4eca-bde1-0b6cb0c84aad/roomplan.json",
      "role" : "raw_roomplan_json"
    },
    {
      "path" : "Original Exports/floor-1/22bfb513-226d-4eca-bde1-0b6cb0c84aad/depth-samples.bin",
      "role" : "raw_depth"
    }
  ],
  "rooms" : [
    {
      "heightM" : 2.7,
      "id" : "room-1",
      "label" : "Room 1",
      "polygon" : [
        [
          0,
          0,
          0
        ],
        [
          0,
          0,
          3
        ],
        [
          4,
          0,
          3
        ],
        [
          4,
          0,
          0
        ]
      ]
    }
  ],
  "schemaVersion" : "1.1.0",
  "visitId" : "c1b6d1fb-17af-4f4a-877c-2565ef9bdb86",
  "walls" : [
    {
      "confidence" : "high",
      "end" : [
        0,
        0,
        3
      ],
      "heightM" : 2.7,
      "id" : "wall-1",
      "roomIds" : [
        "room-1"
      ],
      "start" : [
        0,
        0,
        0
      ],
      "thicknessM" : 0
    },
    {
      "confidence" : "high",
      "end" : [
        4,
        0,
        3
      ],
      "heightM" : 2.7,
      "id" : "wall-2",
      "roomIds" : [
        "room-1"
      ],
      "start" : [
        0,
        0,
        3
      ],
      "thicknessM" : 0
    },
    {
      "confidence" : "high",
      "end" : [
        4,
        0,
        0
      ],
      "heightM" : 2.7,
      "id" : "wall-3",
      "roomIds" : [
        "room-1"
      ],
      "start" : [
        4,
        0,
        3
      ],
      "thicknessM" : 0
    },
    {
      "confidence" : "high",
      "end" : [
        0,
        0,
        0
      ],
      "heightM" : 2.7,
      "id" : "wall-4",
      "roomIds" : [
        "room-1"
      ],
      "start" : [
        4,
        0,
        0
      ],
      "thicknessM" : 0
    }
  ],
  "windows" : [
    {
      "bottomM" : 0.9,
      "confidence" : "high",
      "heightM" : 1.2,
      "id" : "window-1",
      "offsetM" : 2,
      "wallId" : "wall-2",
      "widthM" : 1.2
    }
  ]
}