{
  "areaKey" : "floor-1",
  "captureId" : "9d4e7b12-5a3c-4f86-b2e1-7c0a9f3d6e58",
  "coordinateSystem" : {
    "handedness" : "right",
    "units" : "m",
    "up" : "+Y"
  },
  "doors" : [
    {
      "bottomM" : 0,
      "confidence" : "high",
      "heightM" : 2.1,
      "id" : "door-1",
      "isOpen" : false,
      "offsetM" : 4.5,
      "wallId" : "wall-2",
      "widthM" : 0.9
    }
  ],
  "label" : "Floor 1",
  "objects" : [
    {
      "box" : {
        "center" : [
          0.5,
          1.35,
          1.5
        ],
        "rotation" : [
          0,
          0,
          0,
          1
        ],
        "sizeM" : [
          1,
          2.7,
          3
        ]
      },
      "category" : "stairs",
      "confidence" : "high",
      "id" : "object-1",
      "roomId" : "room-1"
    }
  ],
  "openings" : [

  ],
  "refs" : [

  ],
  "rooms" : [
    {
      "heightM" : 2.7,
      "id" : "room-1",
      "label" : "Living Room",
      "polygon" : [
        [
          0,
          0,
          0
        ],
        [
          0,
          0,
          5
        ],
        [
          6,
          0,
          5
        ],
        [
          6,
          0,
          0
        ]
      ],
      "type" : "living_room",
      "typeSource" : "roomplan_section"
    }
  ],
  "schemaVersion" : "1.1.0",
  "visitId" : "6f1c2a8e-3b7d-4e59-9a14-2c8d5e7f0b31",
  "walls" : [
    {
      "confidence" : "high",
      "end" : [
        0,
        0,
        5
      ],
      "heightM" : 2.7,
      "id" : "wall-1",
      "roomIds" : [
        "room-1"
      ],
      "start" : [
        0,
        0,
        0
      ],
      "thicknessM" : 0
    },
    {
      "confidence" : "high",
      "end" : [
        6,
        0,
        5
      ],
      "heightM" : 2.7,
      "id" : "wall-2",
      "roomIds" : [
        "room-1"
      ],
      "start" : [
        0,
        0,
        5
      ],
      "thicknessM" : 0
    },
    {
      "confidence" : "high",
      "end" : [
        6,
        0,
        0
      ],
      "heightM" : 2.7,
      "id" : "wall-3",
      "roomIds" : [
        "room-1"
      ],
      "start" : [
        6,
        0,
        5
      ],
      "thicknessM" : 0
    },
    {
      "confidence" : "high",
      "end" : [
        0,
        0,
        0
      ],
      "heightM" : 2.7,
      "id" : "wall-4",
      "roomIds" : [
        "room-1"
      ],
      "start" : [
        6,
        0,
        0
      ],
      "thicknessM" : 0
    }
  ],
  "windows" : [
    {
      "bottomM" : 0.9,
      "confidence" : "high",
      "heightM" : 1.2,
      "id" : "window-1",
      "offsetM" : 2.5,
      "wallId" : "wall-3",
      "widthM" : 1.2
    }
  ]
}