{
  "areaKey" : "floor-1",
  "captureId" : "9d4e7b12-5a3c-4f86-b2e1-7c0a9f3d6e58",
  "coordinateSystem" : {
    "handedness" : "right",
    "units" : "m",
    "up" : "+Y"
  },
  "doors" : [
    {
      "bottomM" : 0,
      "confidence" : "high",
      "heightM" : 2.1,
      "id" : "door-1",
      "isOpen" : false,
      "offsetM" : 1,
      "wallId" : "wall-3",
      "widthM" : 0.9
    }
  ],
  "label" : "Floor 1",
  "objects" : [
    {
      "box" : {
        "center" : [
          2.5,
          0.4,
          3.2
        ],
        "rotation" : [
          0,
          0,
          0,
          1
        ],
        "sizeM" : [
          2,
          0.8,
          0.9
        ]
      },
      "category" : "sofa",
      "confidence" : "high",
      "id" : "object-1",
      "roomId" : "room-1"
    },
    {
      "box" : {
        "center" : [
          6.8,
          0.25,
          2
        ],
        "rotation" : [
          0,
          0.707107,
          0,
          0.707107
        ],
        "sizeM" : [
          1.6,
          0.5,
          2
        ]
      },
      "category" : "bed",
      "confidence" : "high",
      "id" : "object-2",
      "roomId" : "room-2"
    }
  ],
  "openings" : [
    {
      "bottomM" : 0,
      "confidence" : "high",
      "heightM" : 2.1,
      "id" : "opening-1",
      "offsetM" : 1.5,
      "wallId" : "wall-4",
      "widthM" : 1
    }
  ],
  "refs" : [

  ],
  "rooms" : [
    {
      "heightM" : 2.7,
      "id" : "room-1",
      "label" : "Living Room",
      "polygon" : [
        [
          0,
          0,
          0
        ],
        [
          0,
          0,
          4
        ],
        [
          5,
          0,
          4
        ],
        [
          5,
          0,
          0
        ]
      ],
      "type" : "living_room",
      "typeSource" : "roomplan_section"
    },
    {
      "heightM" : 2.7,
      "id" : "room-2",
      "label" : "Bedroom",
      "polygon" : [
        [
          5,
          0,
          0
        ],
        [
          5,
          0,
          4
        ],
        [
          8,
          0,
          4
        ],
        [
          8,
          0,
          0
        ]
      ],
      "type" : "bedroom",
      "typeSource" : "roomplan_section"
    }
  ],
  "schemaVersion" : "1.1.0",
  "visitId" : "6f1c2a8e-3b7d-4e59-9a14-2c8d5e7f0b31",
  "walls" : [
    {
      "confidence" : "high",
      "end" : [
        0,
        0,
        4
      ],
      "heightM" : 2.7,
      "id" : "wall-1",
      "roomIds" : [
        "room-1"
      ],
      "start" : [
        0,
        0,
        0
      ],
      "thicknessM" : 0
    },
    {
      "confidence" : "high",
      "end" : [
        5,
        0,
        4
      ],
      "heightM" : 2.7,
      "id" : "wall-2",
      "roomIds" : [
        "room-1"
      ],
      "start" : [
        0,
        0,
        4
      ],
      "thicknessM" : 0
    },
    {
      "confidence" : "high",
      "end" : [
        5,
        0,
        0
      ],
      "heightM" : 2.7,
      "id" : "wall-3",
      "roomIds" : [
        "room-1"
      ],
      "start" : [
        5,
        0,
        4
      ],
      "thicknessM" : 0
    },
    {
      "confidence" : "high",
      "end" : [
        0,
        0,
        0
      ],
      "heightM" : 2.7,
      "id" : "wall-4",
      "roomIds" : [
        "room-1"
      ],
      "start" : [
        5,
        0,
        0
      ],
      "thicknessM" : 0
    },
    {
      "confidence" : "high",
      "end" : [
        5,
        0,
        4
      ],
      "heightM" : 2.7,
      "id" : "wall-5",
      "roomIds" : [
        "room-2"
      ],
      "start" : [
        5,
        0,
        0
      ],
      "thicknessM" : 0
    },
    {
      "confidence" : "high",
      "end" : [
        8,
        0,
        4
      ],
      "heightM" : 2.7,
      "id" : "wall-6",
      "roomIds" : [
        "room-2"
      ],
      "start" : [
        5,
        0,
        4
      ],
      "thicknessM" : 0
    },
    {
      "confidence" : "high",
      "end" : [
        8,
        0,
        0
      ],
      "heightM" : 2.7,
      "id" : "wall-7",
      "roomIds" : [
        "room-2"
      ],
      "start" : [
        8,
        0,
        4
      ],
      "thicknessM" : 0
    },
    {
      "confidence" : "high",
      "end" : [
        5,
        0,
        0
      ],
      "heightM" : 2.7,
      "id" : "wall-8",
      "roomIds" : [
        "room-2"
      ],
      "start" : [
        8,
        0,
        0
      ],
      "thicknessM" : 0
    }
  ],
  "windows" : [
    {
      "bottomM" : 0.9,
      "confidence" : "high",
      "heightM" : 1.2,
      "id" : "window-1",
      "offsetM" : 2,
      "wallId" : "wall-1",
      "widthM" : 1.5
    },
    {
      "bottomM" : 0.9,
      "confidence" : "high",
      "heightM" : 1.2,
      "id" : "window-2",
      "offsetM" : 2,
      "wallId" : "wall-7",
      "widthM" : 1.2
    }
  ]
}