{
  "areaKey" : "floor-1",
  "captureId" : "ba028a66-d76e-4616-b0d6-e3e04e5c9535",
  "coordinateSystem" : {
    "handedness" : "right",
    "units" : "m",
    "up" : "+Y"
  },
  "doors" : [
    {
      "bottomM" : 0,
      "confidence" : "high",
      "heightM" : 2.1,
      "id" : "door-1",
      "isOpen" : false,
      "offsetM" : 4.5,
      "wallId" : "wall-2",
      "widthM" : 0.9
    }
  ],
  "label" : "Floor 1",
  "objects" : [
    {
      "box" : {
        "center" : [
          0.5,
          1.35,
          1.5
        ],
        "rotation" : [
          0,
          0,
          0,
          1
        ],
        "sizeM" : [
          1,
          2.7,
          3
        ]
      },
      "category" : "stairs",
      "confidence" : "high",
      "id" : "object-1",
      "roomId" : "room-1"
    }
  ],
  "openings" : [

  ],
  "refs" : [
    {
      "path" : "Original Exports/floor-1/ba028a66-d76e-4616-b0d6-e3e04e5c9535/roomplan.json",
      "role" : "raw_roomplan_json"
    },
    {
      "path" : "Original Exports/floor-1/ba028a66-d76e-4616-b0d6-e3e04e5c9535/depth-samples.bin",
      "role" : "raw_depth"
    }
  ],
  "rooms" : [
    {
      "heightM" : 2.7,
      "id" : "room-1",
      "label" : "Shower",
      "polygon" : [
        [
          0,
          0,
          0
        ],
        [
          0,
          0,
          5
        ],
        [
          6,
          0,
          5
        ],
        [
          6,
          0,
          0
        ]
      ],
      "type" : "bathroom",
      "typeSource" : "operator"
    }
  ],
  "schemaVersion" : "1.1.0",
  "visitId" : "d205358c-0394-44af-b86c-69bc3fdd9d21",
  "walls" : [
    {
      "confidence" : "high",
      "end" : [
        0,
        0,
        5
      ],
      "heightM" : 2.7,
      "id" : "wall-1",
      "roomIds" : [
        "room-1"
      ],
      "start" : [
        0,
        0,
        0
      ],
      "thicknessM" : 0
    },
    {
      "confidence" : "high",
      "end" : [
        6,
        0,
        5
      ],
      "heightM" : 2.7,
      "id" : "wall-2",
      "roomIds" : [
        "room-1"
      ],
      "start" : [
        0,
        0,
        5
      ],
      "thicknessM" : 0
    },
    {
      "confidence" : "high",
      "end" : [
        6,
        0,
        0
      ],
      "heightM" : 2.7,
      "id" : "wall-3",
      "roomIds" : [
        "room-1"
      ],
      "start" : [
        6,
        0,
        5
      ],
      "thicknessM" : 0
    },
    {
      "confidence" : "high",
      "end" : [
        0,
        0,
        0
      ],
      "heightM" : 2.7,
      "id" : "wall-4",
      "roomIds" : [
        "room-1"
      ],
      "start" : [
        6,
        0,
        0
      ],
      "thicknessM" : 0
    }
  ],
  "windows" : [
    {
      "bottomM" : 0.9,
      "confidence" : "high",
      "heightM" : 1.2,
      "id" : "window-1",
      "offsetM" : 2.5,
      "wallId" : "wall-3",
      "widthM" : 1.2
    }
  ]
}