{
  "schemaVersion": "1.0.0",
  "visitId": "d205358c-0394-44af-b86c-69bc3fdd9d21",
  "captureId": "ba028a66-d76e-4616-b0d6-e3e04e5c9535",
  "areaKey": "floor-1",
  "label": "Floor 1",
  "coordinateSystem": { "units": "m", "handedness": "right", "up": "+Y" },
  "rooms": [
    {
      "id": "room-1",
      "label": "Living Room",
      "polygon": [
        [0, 0, 0],
        [0, 0, 5],
        [6, 0, 5],
        [6, 0, 0]
      ],
      "heightM": 2.7
    }
  ],
  "walls": [
    {
      "id": "wall-1",
      "start": [0, 0, 0],
      "end": [0, 0, 5],
      "heightM": 2.7,
      "thicknessM": 0,
      "roomIds": ["room-1"],
      "confidence": "high"
    },
    {
      "id": "wall-2",
      "start": [0, 0, 5],
      "end": [6, 0, 5],
      "heightM": 2.7,
      "thicknessM": 0,
      "roomIds": ["room-1"],
      "confidence": "high"
    },
    {
      "id": "wall-3",
      "start": [6, 0, 5],
      "end": [6, 0, 0],
      "heightM": 2.7,
      "thicknessM": 0,
      "roomIds": ["room-1"],
      "confidence": "high"
    },
    {
      "id": "wall-4",
      "start": [6, 0, 0],
      "end": [0, 0, 0],
      "heightM": 2.7,
      "thicknessM": 0,
      "roomIds": ["room-1"],
      "confidence": "high"
    }
  ],
  "doors": [
    {
      "id": "door-1",
      "wallId": "wall-2",
      "offsetM": 4.5,
      "bottomM": 0,
      "widthM": 0.9,
      "heightM": 2.1
    }
  ],
  "windows": [
    {
      "id": "window-1",
      "wallId": "wall-3",
      "offsetM": 2.5,
      "bottomM": 0.9,
      "widthM": 1.2,
      "heightM": 1.2
    }
  ],
  "openings": [],
  "objects": [
    {
      "id": "object-1",
      "category": "stairs",
      "roomId": "room-1",
      "box": { "center": [0.5, 1.35, 1.5], "sizeM": [1, 2.7, 3], "rotation": [0, 0, 0, 1] },
      "confidence": "high"
    }
  ],
  "refs": [
    {
      "role": "raw_roomplan_json",
      "path": "Original Exports/floor-1/ba028a66-d76e-4616-b0d6-e3e04e5c9535/roomplan.json"
    },
    {
      "role": "raw_depth",
      "path": "Original Exports/floor-1/ba028a66-d76e-4616-b0d6-e3e04e5c9535/depth-samples.bin"
    },
    {
      "role": "mesh_glb",
      "path": "Original Exports/floor-1/ba028a66-d76e-4616-b0d6-e3e04e5c9535/mesh.glb"
    },
    {
      "role": "mesh_obj",
      "path": "Original Exports/floor-1/ba028a66-d76e-4616-b0d6-e3e04e5c9535/mesh.obj"
    },
    {
      "role": "point_cloud_las",
      "path": "Original Exports/floor-1/ba028a66-d76e-4616-b0d6-e3e04e5c9535/points.las"
    }
  ]
}
