{
  "schemaVersion": "1.0.0",
  "visitId": "4b9c4ede-de5e-47e9-a9cc-fcdf050df74f",
  "captureId": "80d5ff80-5172-40f3-acc9-5cf59acdfd61",
  "areaKey": "floor-1",
  "label": "Floor 1",
  "coordinateSystem": { "units": "m", "handedness": "right", "up": "+Y" },
  "rooms": [
    {
      "id": "room-1",
      "label": "Living Room",
      "polygon": [
        [0, 0, 0],
        [0, 0, 4],
        [5, 0, 4],
        [5, 0, 0]
      ],
      "heightM": 2.7
    },
    {
      "id": "room-2",
      "label": "Bedroom",
      "polygon": [
        [5, 0, 0],
        [5, 0, 4],
        [8, 0, 4],
        [8, 0, 0]
      ],
      "heightM": 2.7
    }
  ],
  "walls": [
    {
      "id": "wall-1",
      "start": [0, 0, 0],
      "end": [0, 0, 4],
      "heightM": 2.7,
      "thicknessM": 0,
      "roomIds": ["room-1"],
      "confidence": "high"
    },
    {
      "id": "wall-2",
      "start": [0, 0, 4],
      "end": [5, 0, 4],
      "heightM": 2.7,
      "thicknessM": 0,
      "roomIds": ["room-1"],
      "confidence": "high"
    },
    {
      "id": "wall-3",
      "start": [5, 0, 4],
      "end": [5, 0, 0],
      "heightM": 2.7,
      "thicknessM": 0,
      "roomIds": ["room-1"],
      "confidence": "high"
    },
    {
      "id": "wall-4",
      "start": [5, 0, 0],
      "end": [0, 0, 0],
      "heightM": 2.7,
      "thicknessM": 0,
      "roomIds": ["room-1"],
      "confidence": "high"
    },
    {
      "id": "wall-5",
      "start": [5, 0, 0],
      "end": [5, 0, 4],
      "heightM": 2.7,
      "thicknessM": 0,
      "roomIds": ["room-2"],
      "confidence": "high"
    },
    {
      "id": "wall-6",
      "start": [5, 0, 4],
      "end": [8, 0, 4],
      "heightM": 2.7,
      "thicknessM": 0,
      "roomIds": ["room-2"],
      "confidence": "high"
    },
    {
      "id": "wall-7",
      "start": [8, 0, 4],
      "end": [8, 0, 0],
      "heightM": 2.7,
      "thicknessM": 0,
      "roomIds": ["room-2"],
      "confidence": "high"
    },
    {
      "id": "wall-8",
      "start": [8, 0, 0],
      "end": [5, 0, 0],
      "heightM": 2.7,
      "thicknessM": 0,
      "roomIds": ["room-2"],
      "confidence": "high"
    }
  ],
  "doors": [
    {
      "id": "door-1",
      "wallId": "wall-3",
      "offsetM": 1,
      "bottomM": 0,
      "widthM": 0.9,
      "heightM": 2.1
    }
  ],
  "windows": [
    {
      "id": "window-1",
      "wallId": "wall-1",
      "offsetM": 2,
      "bottomM": 0.9,
      "widthM": 1.5,
      "heightM": 1.2
    },
    {
      "id": "window-2",
      "wallId": "wall-7",
      "offsetM": 2,
      "bottomM": 0.9,
      "widthM": 1.2,
      "heightM": 1.2
    }
  ],
  "openings": [
    {
      "id": "opening-1",
      "wallId": "wall-4",
      "offsetM": 1.5,
      "bottomM": 0,
      "widthM": 1,
      "heightM": 2.1
    }
  ],
  "objects": [
    {
      "id": "object-1",
      "category": "sofa",
      "roomId": "room-1",
      "box": { "center": [2.5, 0.4, 3.2], "sizeM": [2, 0.8, 0.9], "rotation": [0, 0, 0, 1] },
      "confidence": "high"
    },
    {
      "id": "object-2",
      "category": "bed",
      "roomId": "room-2",
      "box": {
        "center": [6.8, 0.25, 2],
        "sizeM": [1.6, 0.5, 2],
        "rotation": [0, 0.707107, 0, 0.707107]
      },
      "confidence": "high"
    }
  ],
  "refs": [
    {
      "role": "raw_roomplan_json",
      "path": "Original Exports/floor-1/80d5ff80-5172-40f3-acc9-5cf59acdfd61/roomplan.json"
    },
    {
      "role": "raw_depth",
      "path": "Original Exports/floor-1/80d5ff80-5172-40f3-acc9-5cf59acdfd61/depth-samples.bin"
    },
    {
      "role": "mesh_glb",
      "path": "Original Exports/floor-1/80d5ff80-5172-40f3-acc9-5cf59acdfd61/mesh.glb"
    },
    {
      "role": "mesh_obj",
      "path": "Original Exports/floor-1/80d5ff80-5172-40f3-acc9-5cf59acdfd61/mesh.obj"
    },
    {
      "role": "point_cloud_las",
      "path": "Original Exports/floor-1/80d5ff80-5172-40f3-acc9-5cf59acdfd61/points.las"
    }
  ]
}
